{
  "baseline_git_sha": "5567757e8286bd9e9f643689f6b7da5a7dfe06c7",
  "generated_at": "2026-09-26",
  "fail_closed": true,
  "historical_audit_baseline_unverified": {
    "discovered_controls": 1421,
    "live_non_na": 1136,
    "pass": 713,
    "fail": 2,
    "internal_blocked": 247,
    "external_blocked": 173,
    "awaiting_integration_deployment": 1,
    "status": "historical_only_not_used_for_lock"
  },
  "repo_discovery": {
    "origin_main_sha": "5567757e8286bd9e9f643689f6b7da5a7dfe06c7",
    "isolated_branch": "cursor/production-release-locks-bb27",
    "dirty_worktree_at_discovery": false,
    "codeowners_on_main": false,
    "github_environment_protection_in_repo": false,
    "workflows_on_main": [
      ".github/workflows/aws-migration-ci.yml",
      ".github/workflows/tax-profile-migration-guard.yml"
    ],
    "lambda_aliases_in_repo": "none",
      "spa_lock_files_on_main": "production-spa component records live checksops.com index-DyoF7zdg.js; origin/main source is not guaranteed to be that baseline"
  },
  "github_enforcement": {
    "status": "REVISION_REQUIRED_UNTIL_ENFORCED",
    "release_locks_required_status_check": false,
    "codeowners_reviews_required": false,
    "admin_bypass_disabled": false,
    "direct_pushes_disabled": false,
    "base_owned_workflow_enforced": false,
    "repository_evidence_proves_live_aws": false,
    "notes": "Repository validation protects the release process but cannot independently prove live AWS truth. pull_request_target is forbidden. GitHub must require the release-locks check, require code-owner review, and disable direct pushes/admin bypass. The pre-existing aws-migration-guards failure is unrelated and must not be hidden or renamed."
  },
  "conflicts": [
    "aws/production/LIVE_RESOURCES.md (2026-09-05) says Cognito production pool has 0 users and CloudFront aliases 0; later cutover docs claim apex/www on E1B0ZWWO5559U5.",
    "Background claims production SPA Cognito cutover, Moov webhook live, CheckAlt execution enabled; origin/main template flags remain false and webhook docs still say production URLs remain on Supabase.",
    "Open PRs #316/#317/#319/#326/#333 record SPA bundle names (including index-CiOVNYWh.js) that are not on origin/main."
  ],
  "components": {
    "delete-check-contract": {
      "classification": "UNVERIFIED",
      "git_sha": "f5d616431642ce5938827379c9221c822fea5bf3",
      "merged_pr": 501,
      "deployed_artifact": "Accepted post-deploy production-prep Lambda CodeSha256 Hhij5GWW/GDBcRE+4wYomml96R+6IWwFJPczbz5YLZM= (staging-accepted workflow.mjs overlaid onto then-live production-prep package).",
      "applied_migrations": "n/a (behavioral contract guarded by release-locks + invariant tests)",
      "environment": "production-prep",
      "missing_evidence": [
        "immutable production-prep Lambda version/alias fingerprint recorded in-repo for the Delete Check contract",
        "independent live-package hash capture for the accepted CodeSha256 baseline"
      ],
      "open_pr_overlap": []
    },
    "identity-cognito": {
      "classification": "UNVERIFIED",
      "git_sha": "5567757e8286bd9e9f643689f6b7da5a7dfe06c7",
      "deployed_artifact": "not provable from origin/main",
      "applied_migrations": "source hashes recorded; apply not proven",
      "environment": "unknown",
      "missing_evidence": [
        "live Cognito user count",
        "deployed SPA Cognito client id fingerprint",
        "production identity_accounts apply proof"
      ],
      "open_pr_overlap": ["#316", "#317", "#319", "#313", "#240"]
    },
    "moov-production-read": {
      "classification": "UNVERIFIED",
      "git_sha": "3a54dbeda990f2b026a5bde356fc2b216ece0f9d",
      "deployed_artifact": "not deployed",
      "applied_migrations": "none",
      "environment": "unknown",
      "missing_evidence": ["staging acceptance", "production overlay receipts"],
      "open_pr_overlap": []
    },
    "moov-production-send": {
      "classification": "UNVERIFIED",
      "git_sha": "b03e47eec7d598ccd6f09b1a07a0b7dfc91bf8bb",
      "deployed_artifact": "not deployed",
      "applied_migrations": "none (uses SQL 72 member policies)",
      "environment": "unknown",
      "missing_evidence": ["staging acceptance", "production overlay receipts"],
      "open_pr_overlap": []
    },
    "moov-production-invoice": {
      "classification": "UNVERIFIED",
      "git_sha": "55efb6e4df33ca548faeda6ed7317915949e4e99",
      "deployed_artifact": "not deployed",
      "applied_migrations": "none (moov_invoices / moov_invoice_customers from the Supabase restore; production grants not yet inspected)",
      "environment": "unknown",
      "missing_evidence": ["production read-only inspect of moov_invoices / moov_invoice_customers grants", "staging acceptance", "production overlay receipts"],
      "open_pr_overlap": []
    },
    "moov-production-fund": {
      "classification": "UNVERIFIED",
      "git_sha": "a4be10ebbc8db5576755f3e20c024d581c462dd2",
      "deployed_artifact": "not deployed",
      "applied_migrations": "72_member_payment_writes.sql source-only",
      "environment": "unknown",
      "missing_evidence": ["SQL 72 staging and production apply", "staging acceptance", "production overlay receipts"],
      "open_pr_overlap": []
    },
    "moov-webhooks": {
      "classification": "UNVERIFIED",
      "git_sha": "5567757e8286bd9e9f643689f6b7da5a7dfe06c7",
      "deployed_artifact": "Lambda alias/version not in repo",
      "applied_migrations": "40_tranche4_webhook_receipts.sql source-only",
      "environment": "unknown",
      "missing_evidence": [
        "production Lambda version",
        "independent signed webhook receipt",
        "confirmation Supabase webhook remains disabled"
      ],
      "open_pr_overlap": ["#314", "#315", "#308"]
    },
    "checkalt-submission": {
      "classification": "UNVERIFIED",
      "git_sha": "5567757e8286bd9e9f643689f6b7da5a7dfe06c7",
      "deployed_artifact": "not provable",
      "applied_migrations": "65_checkalt_production_writer.sql is NOT_APPLIED in git",
      "environment": "unknown",
      "missing_evidence": [
        "production AWS_CHECKALT_ENABLED live value",
        "writer SQL apply hash",
        "deployed Lambda version"
      ],
      "open_pr_overlap": ["#327", "#332", "#339", "#322", "#323"]
    },
    "financial-ledger": {
      "classification": "UNVERIFIED",
      "git_sha": "5567757e8286bd9e9f643689f6b7da5a7dfe06c7",
      "deployed_artifact": "not provable",
      "applied_migrations": "64_financial_activation_grants.sql NOT_APPLIED",
      "environment": "unknown",
      "missing_evidence": [
        "production financial permission flag",
        "reconciliation apply proof"
      ],
      "open_pr_overlap": ["#315", "#310", "#309"]
    },
    "tenant-email": {
      "classification": "SOURCE_LOCKED_NOT_ACTIVE",
      "git_sha": "5567757e8286bd9e9f643689f6b7da5a7dfe06c7",
      "deployed_artifact": "AWS_TENANT_EMAIL_DOMAIN_ENABLED false in template.yaml",
      "applied_migrations": "NOT_APPLIED_20260910_tenant_email_ses_domain.sql",
      "environment": "source-only",
      "missing_evidence": [
        "production SES enablement proof",
        "SQL apply hash"
      ],
      "open_pr_overlap": ["#233", "#231", "#255"]
    },
    "partner-sharing": {
      "classification": "SOURCE_LOCKED_NOT_ACTIVE",
      "git_sha": "9aac7bb5b1ed0a8d03e305552797a9acfacc7f64",
      "merged_pr": 302,
      "merge_commit": "faf9b82e728bd7ef42009e4c96ace05c7bd7232f",
      "deployed_artifact": "production SQL 31/32/33/34 applied; application/API/UI repair unmerged in PR 350",
      "applied_migrations": "31/32/33/34 APPLIED IN PRODUCTION; see ops/release-locks/proof/c1c-partner-share-production-apply.md; do not reapply",
      "environment": "production",
      "missing_evidence": [
        "merged git SHA for 33/34 and authorization/UI repair (#350 still open)",
        "Lambda version serving partner-share-lifecycle.mjs / authorization.mjs",
        "SPA bundle fingerprint containing ShareCheckDialog and CheckCommandCenter partner queue"
      ],
      "open_pr_overlap": ["#350", "#347", "#342", "#339", "#332", "#327", "#312"]
    },
    "mortgage-ops": {
      "classification": "SOURCE_LOCKED_NOT_ACTIVE",
      "git_sha": "5567757e8286bd9e9f643689f6b7da5a7dfe06c7",
      "deployed_artifact": "SQL header says do not apply from the commit-only PR",
      "applied_migrations": "29/30 and supabase 20260911210000 source-only",
      "environment": "source-only",
      "missing_evidence": [
        "production/staging apply proof for SQL 29/30"
      ],
      "open_pr_overlap": ["#249", "#248", "#282"]
    },
    "auto-deposit": {
      "classification": "UNVERIFIED",
      "git_sha": "5567757e8286bd9e9f643689f6b7da5a7dfe06c7",
      "deployed_artifact": "tenant auto-deposit PR #339 not merged; not deployed",
      "applied_migrations": "none proven",
      "environment": "source-only",
      "missing_evidence": [
        "merged auto-deposit source",
        "production activation flag proof"
      ],
      "open_pr_overlap": ["#342", "#339", "#327", "#332"]
    },
    "database-rls": {
      "classification": "UNVERIFIED",
      "git_sha": "5567757e8286bd9e9f643689f6b7da5a7dfe06c7",
      "deployed_artifact": "staging oneshot apply docs exist; production unproven",
      "applied_migrations": "aws/rls/sql tree hashed; live DB hash unknown",
      "environment": "unknown",
      "missing_evidence": [
        "production RLS catalog hash"
      ],
      "open_pr_overlap": ["#289", "#249", "#288"]
    },
    "provider-secrets": {
      "classification": "UNVERIFIED",
      "git_sha": "5567757e8286bd9e9f643689f6b7da5a7dfe06c7",
      "deployed_artifact": "secret names only; values never recorded",
      "applied_migrations": "n/a",
      "environment": "unknown",
      "missing_evidence": [
        "Secrets Manager version IDs (not secret values)"
      ],